{
  "schema": 1,
  "project": "labby",
  "model": "capability_visibility",
  "invariant": "LABBY-CAP-002",
  "origin": {
    "kind": "manual",
    "reference": "missing gateway feature with configured upstream"
  },
  "initial": {},
  "steps": [
    {
      "action": "disable_gateway_feature"
    },
    {
      "action": "configure_upstream"
    },
    {
      "action": "start"
    }
  ],
  "expect": "invariant_holds",
  "status": "active"
}
