{
  "schema": 1,
  "project": "labby",
  "model": "capability_visibility",
  "invariant": "LABBY-CAP-003",
  "origin": {
    "kind": "manual",
    "reference": "runtime optional subsystem degradation"
  },
  "initial": {},
  "steps": [
    {
      "action": "start"
    },
    {
      "action": "record_runtime_degradation",
      "code": "artifacts"
    }
  ],
  "expect": "invariant_holds",
  "status": "active"
}
